<?xml version="1.0" encoding="UTF-8" standalone="no"?>

<!-- Comment out next line after testing complete -->
<!DOCTYPE ip_presets SYSTEM "./preset.dtd">
<!-- Copyright (C) 2024, New Wave Design and Verification
	THIS DOCUMENT AND THE INFORMATION CONTAINED HEREIN IS PROPRIETARY
	AND CONFIDENTIAL TO NEW WAVE DESIGN AND VERIFICATION AND SHALL NOT
	BE USED, DISTRIBUTED OR REPRODUCED FOR ANY PURPOSE, EXCEPT
	WITH THE WRITTEN CONSENT OF NEW WAVE DESIGN AND VERIFICATION. -->

<!-- Preset file:  Provides a list of predefined IP configuration options for the different IP
	used to implement bus interfaces in a design project. The preset file is used by the
	Vivado Design Suite when the IP is customized from the IP catalog and added into the
	design. This file is located in the board repository, in the same folder or directory as the
	Board Interface file.

	17 Jan, 2024 - SBJ - Initial entry.
	-->

<ip_presets schema="1.0">
	<ip_preset preset_proc_name="ps_pmc_fixed_io_preset">
		<ip vendor="xilinx.com" library="ip" name="versal_cips" version="*" ip_interface="FIXED_IO">
			<user_parameters>
				<user_hier_parameter name="CONFIG.PS_PMC_CONFIG">
					<user_hier_parameter name="PMC_MIO11">
						<user_parameter name="AUX_IO" value="0"/>
						<user_parameter name="DIRECTION" value="in"/>
						<user_parameter name="DRIVE_STRENGTH" value="8mA"/>
						<user_parameter name="OUTPUT_DATA" value="default"/>
						<user_parameter name="PULL" value="disable"/>
						<user_parameter name="SCHMITT" value="0"/>
						<user_parameter name="SLEW" value="slow"/>
						<user_parameter name="USAGE" value="AUXIO"/>
					</user_hier_parameter>
					<user_hier_parameter name="PMC_MIO12">
						<user_parameter name="AUX_IO" value="0"/>
						<user_parameter name="DIRECTION" value="out"/>
						<user_parameter name="DRIVE_STRENGTH" value="8mA"/>
						<user_parameter name="OUTPUT_DATA" value="high"/>
						<user_parameter name="PULL" value="pullup"/>
						<user_parameter name="SCHMITT" value="0"/>
						<user_parameter name="SLEW" value="slow"/>
						<user_parameter name="USAGE" value="GPIO"/>
					</user_hier_parameter>
					<user_hier_parameter name="PMC_MIO24">
						<user_parameter name="AUX_IO" value="0"/>
						<user_parameter name="DIRECTION" value="in"/>
						<user_parameter name="DRIVE_STRENGTH" value="8mA"/>
						<user_parameter name="OUTPUT_DATA" value="default"/>
						<user_parameter name="PULL" value="disable"/>
						<user_parameter name="SCHMITT" value="0"/>
						<user_parameter name="SLEW" value="slow"/>
						<user_parameter name="USAGE" value="AUXIO"/>
					</user_hier_parameter>
					<user_hier_parameter name="PMC_MIO25">
						<user_parameter name="AUX_IO" value="0"/>
						<user_parameter name="DIRECTION" value="out"/>
						<user_parameter name="DRIVE_STRENGTH" value="8mA"/>
						<user_parameter name="OUTPUT_DATA" value="high"/>
						<user_parameter name="PULL" value="pullup"/>
						<user_parameter name="SCHMITT" value="0"/>
						<user_parameter name="SLEW" value="slow"/>
						<user_parameter name="USAGE" value="GPIO"/>
					</user_hier_parameter>
					<user_hier_parameter name="PMC_OSPI_PERIPHERAL">
						<user_parameter name="ENABLE" value="1"/>
						<user_hier_parameter name="IO">
							<user_parameter name="PMC_MIO" value="0 .. 11"/>
						</user_hier_parameter>
						<user_parameter name="MODE" value="Single"/>
					</user_hier_parameter>
					<user_hier_parameter name="PMC_OT_CHECK">
						<user_parameter name="DELAY" value="0"/>
						<user_parameter name="ENABLE" value="1"/>
					</user_hier_parameter>
					<user_hier_parameter name="PMC_SD0">
						<user_parameter name="CD_ENABLE" value="0"/>
						<user_hier_parameter name="CD_IO">
							<user_parameter name="PMC_MIO" value="24"/>
						</user_hier_parameter>
						<user_parameter name="POW_ENABLE" value="0"/>
						<user_hier_parameter name="POW_IO">
							<user_parameter name="PMC_MIO" value="17"/>
						</user_hier_parameter>
						<user_parameter name="RESET_ENABLE" value="1"/>
						<user_hier_parameter name="RESET_IO">
							<user_parameter name="PMC_MIO" value="17"/>
						</user_hier_parameter>
						<user_parameter name="WP_ENABLE" value="0"/>
						<user_hier_parameter name="WP_IO">
							<user_parameter name="PMC_MIO" value="25"/>
						</user_hier_parameter>
					</user_hier_parameter>
					<user_parameter name="PMC_SD0_DATA_TRANSFER_MODE" value="8Bit"/>
					<user_hier_parameter name="PMC_SD0_PERIPHERAL">
						<user_parameter name="CLK_100_SDR_OTAP_DLY" value="0x00"/>
						<user_parameter name="CLK_200_SDR_OTAP_DLY" value="0x2"/>
						<user_parameter name="CLK_50_DDR_ITAP_DLY" value="0x1E"/>
						<user_parameter name="CLK_50_DDR_OTAP_DLY" value="0x5"/>
						<user_parameter name="CLK_50_SDR_ITAP_DLY" value="0x2C"/>
						<user_parameter name="CLK_50_SDR_OTAP_DLY" value="0x5"/>
						<user_parameter name="ENABLE" value="1"/>
						<user_hier_parameter name="IO">
							<user_parameter name="PMC_MIO" value="13 .. 25"/>
						</user_hier_parameter>
					</user_hier_parameter>
					<user_parameter name="PMC_SD0_SLOT_TYPE" value="eMMC"/>
					<user_parameter name="PS_BANK_2_IO_STANDARD" value="LVCMOS3.3"/>
					<user_parameter name="PS_BANK_3_IO_STANDARD" value="LVCMOS3.3"/>
					<user_hier_parameter name="PS_ENET0_MDIO">
						<user_parameter name="ENABLE" value="1"/>
						<user_hier_parameter name="IO">
							<user_parameter name="PMC_MIO" value="50 .. 51"/>
						</user_hier_parameter>
					</user_hier_parameter>
					<user_hier_parameter name="PS_ENET0_PERIPHERAL">
						<user_parameter name="ENABLE" value="1"/>
						<user_hier_parameter name="IO">
							<user_parameter name="PMC_MIO" value="26 .. 37"/>
						</user_hier_parameter>
					</user_hier_parameter>
					<user_hier_parameter name="PS_ENET1_PERIPHERAL">
						<user_parameter name="ENABLE" value="1"/>
						<user_hier_parameter name="IO">
							<user_parameter name="PMC_MIO" value="38 .. 49"/>
						</user_hier_parameter>
					</user_hier_parameter>
					<user_parameter name="PS_GEN_IPI0_ENABLE" value="1"/>
					<user_parameter name="PS_GEN_IPI1_ENABLE" value="1"/>
					<user_parameter name="PS_GEN_IPI2_ENABLE" value="1"/>
					<user_parameter name="PS_GEN_IPI3_ENABLE" value="1"/>
					<user_parameter name="PS_GEN_IPI4_ENABLE" value="1"/>
					<user_parameter name="PS_GEN_IPI5_ENABLE" value="1"/>
					<user_parameter name="PS_GEN_IPI6_ENABLE" value="1"/>
					<user_hier_parameter name="PS_I2C0_PERIPHERAL">
						<user_parameter name="ENABLE" value="1"/>
						<user_hier_parameter name="IO">
							<user_parameter name="PS_MIO" value="6 .. 7"/>
						</user_hier_parameter>
					</user_hier_parameter>
					<user_hier_parameter name="PS_I2C1_PERIPHERAL">
						<user_parameter name="ENABLE" value="1"/>
						<user_hier_parameter name="IO">
							<user_parameter name="PS_MIO" value="0 .. 1"/>
						</user_hier_parameter>
					</user_hier_parameter>
					<user_hier_parameter name="PS_MIO10">
						<user_parameter name="AUX_IO" value="0"/>
						<user_parameter name="DIRECTION" value="in"/>
						<user_parameter name="DRIVE_STRENGTH" value="8mA"/>
						<user_parameter name="OUTPUT_DATA" value="default"/>
						<user_parameter name="PULL" value="disable"/>
						<user_parameter name="SCHMITT" value="0"/>
						<user_parameter name="SLEW" value="slow"/>
						<user_parameter name="USAGE" value="AUXIO"/>
					</user_hier_parameter>
					<user_hier_parameter name="PS_MIO11">
						<user_parameter name="AUX_IO" value="0"/>
						<user_parameter name="DIRECTION" value="in"/>
						<user_parameter name="DRIVE_STRENGTH" value="8mA"/>
						<user_parameter name="OUTPUT_DATA" value="default"/>
						<user_parameter name="PULL" value="disable"/>
						<user_parameter name="SCHMITT" value="0"/>
						<user_parameter name="SLEW" value="slow"/>
						<user_parameter name="USAGE" value="AUXIO"/>
					</user_hier_parameter>
					<user_hier_parameter name="PS_MIO13">
						<user_parameter name="AUX_IO" value="0"/>
						<user_parameter name="DIRECTION" value="in"/>
						<user_parameter name="DRIVE_STRENGTH" value="8mA"/>
						<user_parameter name="OUTPUT_DATA" value="default"/>
						<user_parameter name="PULL" value="disable"/>
						<user_parameter name="SCHMITT" value="0"/>
						<user_parameter name="SLEW" value="slow"/>
						<user_parameter name="USAGE" value="AUXIO"/>
					</user_hier_parameter>
					<user_hier_parameter name="PS_MIO14">
						<user_parameter name="AUX_IO" value="0"/>
						<user_parameter name="DIRECTION" value="in"/>
						<user_parameter name="DRIVE_STRENGTH" value="8mA"/>
						<user_parameter name="OUTPUT_DATA" value="default"/>
						<user_parameter name="PULL" value="disable"/>
						<user_parameter name="SCHMITT" value="0"/>
						<user_parameter name="SLEW" value="slow"/>
						<user_parameter name="USAGE" value="AUXIO"/>
					</user_hier_parameter>
					<user_hier_parameter name="PS_MIO18">
						<user_parameter name="AUX_IO" value="0"/>
						<user_parameter name="DIRECTION" value="in"/>
						<user_parameter name="DRIVE_STRENGTH" value="8mA"/>
						<user_parameter name="OUTPUT_DATA" value="default"/>
						<user_parameter name="PULL" value="pullup"/>
						<user_parameter name="SCHMITT" value="0"/>
						<user_parameter name="SLEW" value="slow"/>
						<user_parameter name="USAGE" value="Reserved"/>
					</user_hier_parameter>
					<user_hier_parameter name="PS_MIO19">
						<user_parameter name="AUX_IO" value="0"/>
						<user_parameter name="DIRECTION" value="in"/>
						<user_parameter name="DRIVE_STRENGTH" value="8mA"/>
						<user_parameter name="OUTPUT_DATA" value="default"/>
						<user_parameter name="PULL" value="pullup"/>
						<user_parameter name="SCHMITT" value="0"/>
						<user_parameter name="SLEW" value="slow"/>